{
    "version": "1.0.0",
    "metadata": {
        "name": "Lure Colors Dataset",
        "description": "A dataset containing various colors of fishing lures.",
        "publisher": "smitchell6879",
        "lastUpdated": "2026-01-19"
    },
    "manufacturers": {
        "creek-chub": {
            "lastUpdated": "2026-01-19",
            "id": "ccbc",
            "name": "The Creek Chub Bait Company",
            "aka": ["CCBC", "Creek Chub"],
            "location": {
                "city": "Garrett",
                "state": "Indiana",
                "country": "USA"
            },
            "tagline": "Catch More Fish!",
            "founded": 1916,
            "officers": {
                "Presidents": [
                    {
                        "name": "Henery Dills",
                        "year": "1916-1927"
                    },
                    {
                        "name": "George Schulthess",
                        "year": "1927-1945"
                    },
                    {
                        "name": "Gordon S. Dills",
                        "year": "1945 - 1958"
                    },
                    {   
                        "name": "Howard Schulthess",
                        "year": "1958-1963"
                    },
                    {   
                        "name": "Leroy Schulthess",
                        "year": "1963-1978"
                    }
                ],
                "Vice Presidents": [
                    {
                        "name": "George Schulthess",
                        "year": "1916-1927"
                    },
                    {
                        "name": "Gordon S. Dills",
                        "year": "1927-1945"
                    },
                    {
                        "name": "Howard Schulthess",
                        "year": "1945 - 1958"
                    },
                    {   
                        "name": "Harry Heinzerling",
                        "year": "1958-1978"
                    }
                ],
                "Secretary": [
                    {
                        "name": "Carl Heinzerling",
                        "year": "1916-1950"
                    },
                    {   
                        "name": "Harry Heinzerling",
                        "year": "1950-1958"
                    },
                    {
                        "name": "Gordon A. Dills",
                        "year": "1958-1978"
                    }
                ],
                "Treasurer": [
                    {
                        "name": "Carl Heinzerling",
                        "year": "1916-1950"
                    },
                    {   
                        "name": "Harry Heinzerling",
                        "year": "1950-1958"
                    },
                    {
                        "name": "Julia Schulthess",
                        "year": "1958-1978"
                    }
                ]
            },
            "history_highlights": [
                {
                    "year": 1916,
                    "event": "First production lure, the Wiggler, made as company begins."
                },
                {
                    "year": 1918,
                    "event": "Company is officially incorporated."
                },
                {
                    "year": 1920,
                    "event": "World Famous Pikie was introduced."
                },
                {
                    "year": 1921,
                    "event": "Patent received for scale pattern produced by spraying paint through netting."
                },
                {
                    "year": 1921,
                    "event": "Intro boxes are replaced with classic two-piece cardboard Creek Chub boxes."
                },
                {
                    "year": 1935,
                    "event": "Military stencils began on the lures and continued through 1950."
                },
                {
                    "year": 1936,
                    "event": "Improved lip and through-wire construction introduced."
                },
                {
                    "year": 1950,
                    "event": "Deep diving lip produced."
                },
                {
                    "year": 1951,
                    "event": "Spinning lures introduced."
                },
                {
                    "year": 1952,
                    "event": "Plastic top box produced."
                },
                {
                    "year": 1954,
                    "event": "Last year for fly rod lures."
                },
                {
                    "year": 1956,
                    "event": "Mass production of plastic lures begins."
                },
                {
                    "year": 1961,
                    "event": "Transition from glass eyes to tack eyes."
                },
                {
                    "year": 1964,
                    "event": "\"Gold Foil\" labels began and continued through 1978."
                },
                {
                    "year": 1975,
                    "event": "The last new lure, the Cheekie, is introduced."
                },
                {
                    "year": 1978,
                    "event": "Company sold to Lazy Ike Corporation."
                }
            ],
            "colors":[
                {
                    "id": "ccbc-00",
                    "name": "Natural Chub",
                    "yearIntroduced": 1916,
                    "yearLastUsed": 1962,
                    "companyId": "00",
                    "pre1925Id": ["00"]
                },
                {
                    "id": "ccbc-00b",
                    "name": "Natural Crab",
                    "yearIntroduced": 1917,
                    "yearLastUsed": 1978,
                    "companyId": "00",
                    "pre1925Id": null
                },
                {
                    "id": "ccbc-00c",
                    "name": "Pikie Scale",
                    "yearIntroduced": 1920,
                    "yearLastUsed": 1978,
                    "companyId": "00",
                    "pre1925Id": ["00"]
                },
                {
                    "id": "ccbc-00d",
                    "name": "Bug Finish",
                    "yearIntroduced": 1924,
                    "yearLastUsed": 1947,
                    "companyId": "00",
                    "pre1925Id": ["00"]
                },
                {
                    "id": "ccbc-01",
                    "name": "Perch",
                    "yearIntroduced": 1917,
                    "yearLastUsed": 1978,
                    "companyId": "01",
                    "pre1925Id": ["01","03","04"]
                },
                {
                    "id": "ccbc-02",
                    "name": "Red Head/White",
                    "yearIntroduced": 1916,
                    "yearLastUsed": 1978,
                    "companyId": "02",
                    "pre1925Id": ["01","03","04"]
                },
                {
                    "id": "ccbc-02b",
                    "name": "Albino",
                    "yearIntroduced": 1918,
                    "yearLastUsed": 1954,
                    "companyId": "02",
                    "pre1925Id": ["01"]
                },
                {
                    "id": "ccbc-03",
                    "name": "Silver Shiner",
                    "yearIntroduced": 1924,
                    "yearLastUsed": 1978,
                    "companyId": "03",
                    "pre1925Id": ["00", "01"]
                },
                {
                    "id": "ccbc-04",
                    "name": "Golden Shiner",
                    "yearIntroduced": 1916,
                    "yearLastUsed": 1978,
                    "companyId": "04",
                    "pre1925Id": ["02","03", "05"]
                },
                {
                    "id": "ccbc-yellow-scale",
                    "name": "Yellow Scale",
                    "yearIntroduced": 1916,
                    "yearLastUsed": 1924,
                    "companyId": null,
                    "pre1925Id": ["03"]
                },
                {
                    "id": "ccbc-05",
                    "name": "Red Side",
                    "yearIntroduced": 1917,
                    "yearLastUsed": 1950,
                    "companyId": "05",
                    "pre1925Id": ["00","01","02"]
                },
                {
                    "id": "ccbc-05b",
                    "name": "Dace",
                    "yearIntroduced": 1931,
                    "yearLastUsed": 1978,
                    "companyId": "05",
                    "pre1925Id": null
                },
                {
                    "id": "ccbc-06",
                    "name": "Goldfish",
                    "yearIntroduced": 1922,
                    "yearLastUsed": 1954,
                    "companyId": "06",
                    "pre1925Id": ["08"]
                },
                {
                    "id": "ccbc-07",
                    "name": "Mullet",
                    "yearIntroduced": 1916,
                    "yearLastUsed": 1978,
                    "companyId": "07",
                    "pre1925Id": ["01"]
                },
                {
                    "id": "ccbc-08",
                    "name": "Rainbow",
                    "yearIntroduced": 1924,
                    "yearLastUsed": 1978,
                    "companyId": "08",
                    "pre1925Id": ["02","06"]
                },
                {
                    "id": "ccbc-09",
                    "name": "Greenback",
                    "yearIntroduced": 1917,
                    "yearLastUsed": 1954,
                    "companyId": "09",